<?xml version="1.0"?>
<tags xmlns:xsi="http://www.w3.org/2001/XMLSchema-instance" xsi:noNamespaceSchemaLocation="tags.xsd"><tag><nome>lorem</nome></tag><tag><nome>latino</nome></tag><tag><nome>prova</nome></tag><tag><nome>riassunto</nome></tag><tag><nome>ciao</nome></tag><tag><nome>inglese</nome></tag><tag><nome>ipsum</nome><riassuntoID>3</riassuntoID></tag><tag><nome>biologia</nome><riassuntoID>3</riassuntoID></tag><tag><nome>sadfsadf</nome><riassuntoID>3</riassuntoID><riassuntoID>1</riassuntoID><riassuntoID>3</riassuntoID><riassuntoID>4</riassuntoID><riassuntoID>5</riassuntoID></tag></tags>
